{
  "template": "canvas2d_space_scroller",
  "title": "Asteroid Cavern",
  "canvas": { "width": 640, "height": 448 },
  "tile_size": 32,
  "hazard_char": "X",
  "theme": {
    "space_color": "#05060f",
    "wall_color": "#2c3358",
    "wall_edge_color": "rgba(120,160,255,0.25)",
    "hazard_color": "#ff5a6a",
    "accent_color": "#7c5cfa",
    "hud_color": "#f4f0ff",
    "exit_color": "#4ade80",
    "collectible_color": "#ffd24a"
  },
  "map": [
    "################################################",
    "#..#####....#.#.#....##.#...##.#.#.##..#..##...#",
    "#...#.#.....#...#....#..#......#.#.##..#..##...#",
    "#...X.......#...........#......#...##.....##...#",
    "#...........X..................X....X..........#",
    "#..............................................#",
    "#..............................................#",
    "#..............................................#",
    "#..............................................#",
    "#.................X............................#",
    "#.X.....X.........#X......#...#..........#...#.#",
    "#.#....X#.......#.##..X..X#...#........#X##..#.#",
    "#.#.#..##....#..#.##..#..####.#......#.#####.#.#",
    "################################################"
  ],
  "player_spawn": { "col": 2, "row": 6 },
  "exit": { "col": 45, "row": 6 },
  "exit_requires_all_collectibles": false,
  "collectibles": [
    { "col": 6, "row": 8 },
    { "col": 12, "row": 8 },
    { "col": 18, "row": 5 },
    { "col": 24, "row": 6 },
    { "col": 30, "row": 6 },
    { "col": 36, "row": 5 },
    { "col": 42, "row": 7 }
  ],
  "ship": { "width": 26, "height": 18, "thrust": 620, "max_speed": 240, "damping": 1.3, "hitbox_scale": 0.7, "color": "#7c5cfa" },
  "parallax": [
    { "type": "color", "color": "#141a3a", "alpha": 0.5 },
    { "type": "stars", "speed": 0.15, "density": 40, "color": "#5d6a98", "size": 1 },
    { "type": "stars", "speed": 0.4, "density": 55, "color": "#a9c2ff", "size": 2 },
    { "type": "stars", "speed": 0.8, "density": 30, "color": "#ffffff", "size": 2 }
  ],
  "lives": 3,
  "score": { "collectible": 100 },
  "assets": { "base_path": "assets/", "sprites": {} }
}
